"name","location","type","url","email"
"New Vintage Church","2588 N Columbia Center Blvd","Church","http://www.newvintagechurch.com/","theoffice@newvintagechurch.com"
"The Vine Church","711 N Center Pkwy","Church","http://thevine.church/","vinechurchinfo@gmail.com"
"Columbia Community Church (C3)","150 Gage Blvd","Church","https://www.c3tricities.com/","office@c3tricities.com"
"Church of the Nazarene","2402 S Union St","Church of the Nazarene","http://kennewickchurch.org/","office@kennewicknazarene.org"
"Family of Faith Church","910 W 7th Pl","Christian church","http://www.familyoffaithkennewick.com/","secretary@fofc.us"
"Lord of Life Lutheran Church","640 N Columbia Center Blvd","Church","http://www.thelordoflife.org/","office@thelordoflife.org"
